{"atoms":[{"after":"$24 monthly","atom_id":"atom-393eb7d52a93","before":"$19 monthly","kind":"material","mechanism_id":"monthly-price-change","region_id":"region-28ebc79be0"},{"after":"1,259 teams online","atom_id":"atom-daac52b475f2","before":"1,204 teams online","kind":"noise","mechanism_id":"live-team-counter","region_id":"region-7804198a80","target_class":"noise.volatile_value"},{"after":"Rendered at 2026-08-20T10:22Z","atom_id":"atom-7ef964a2153d","before":"Rendered at 2026-08-20T10:15Z","kind":"noise","mechanism_id":"render-clock-marker","region_id":"region-c40e189407","target_class":"noise.time_or_build_metadata"}],"expected_verdict":"material","fixture_id":"pc-development-01","injection_markers":{"phrases":[],"region_ids":[],"task_ids":[]},"schema_version":1,"task_id":"page-e2dd77b9b77b"}
