{"atoms":[{"after":"Departure 08:25","atom_id":"atom-be87115f3e29","before":"Departure 08:10","kind":"material","mechanism_id":"train-departure-delay","region_id":"region-b8c7219c8f"},{"after":"Watching 158 riders","atom_id":"atom-52ace5eee445","before":"Watching 144 riders","kind":"noise","mechanism_id":"rider-watch-count","region_id":"region-16a3aaaa69","target_class":"noise.volatile_value"},{"after":"Timetable build tt-903","atom_id":"atom-f6169f5696a2","before":"Timetable build tt-902","kind":"noise","mechanism_id":"timetable-build-number","region_id":"region-e9367212d3","target_class":"noise.time_or_build_metadata"},{"after":"Airport Central Riverside","atom_id":"atom-222f6d97c104","before":"Central Riverside Airport","kind":"noise","mechanism_id":"stop-navigation-rotation","region_id":"region-dc3b0db0d3","target_class":"noise.structure_or_order"}],"expected_verdict":"material","fixture_id":"pc-regression-02","injection_markers":{"phrases":[],"region_ids":[],"task_ids":[]},"schema_version":1,"task_id":"page-4b7129afc57b"}
