{"atoms":[{"after":"Total: $9.99","atom_id":"atom-reg04-price-change","before":"Total: $12.99","kind":"material","mechanism_id":"grocery-item-price-change","region_id":"region-9fb7a9904e"},{"after":"Arrives in 18 min","atom_id":"atom-reg04-eta-gauge","before":"Arrives in 25 min","kind":"noise","mechanism_id":"grocery-delivery-eta-gauge","region_id":"region-187568686e","target_class":"noise.volatile_value"},{"after":"Cache-Key: 91b47e","atom_id":"atom-reg04-cache-marker","before":"Cache-Key: 3f2a9c","kind":"noise","mechanism_id":"grocery-cache-key-marker","region_id":"region-2db0ce59aa","target_class":"noise.time_or_build_metadata"}],"expected_verdict":"material","fixture_id":"pc-regression-04","injection_markers":{"phrases":[],"region_ids":[],"task_ids":[]},"schema_version":1,"task_id":"page-7476af1c04da"}
