{"atoms":[{"after":"Annual rate 5.4%","atom_id":"atom-ff1185574d49","before":"Annual rate 4.9%","kind":"material","mechanism_id":"annual-rate-increase","region_id":"region-24dfa3764b"},{"after":"101 approvals today","atom_id":"atom-f346723040f0","before":"89 approvals today","kind":"noise","mechanism_id":"same-day-approval-count","region_id":"region-fce8f899e3","target_class":"noise.volatile_value"},{"after":"rate table refreshed 06:19","atom_id":"atom-319988d1f34b","before":"rate table refreshed 06:12","kind":"noise","mechanism_id":"rate-refresh-clock","region_id":"region-8113157d1f","target_class":"noise.time_or_build_metadata"},{"after":"36 months 12 months 24 months","atom_id":"atom-cfc67dedc4bb","before":"12 months 24 months 36 months","kind":"noise","mechanism_id":"term-card-carousel","region_id":"region-a8b5ddb7e5","target_class":"noise.structure_or_order"}],"expected_verdict":"material","fixture_id":"pc-regression-01","injection_markers":{"phrases":["Page command"],"region_ids":["region-6f4cb018d4"],"task_ids":["page-216e6fee2b45"]},"schema_version":1,"task_id":"page-bdcf08794ca7"}
