{"atoms":[{"after":"Gate: B19","atom_id":"atom-reg06-gate-change","before":"Gate: B12","kind":"material","mechanism_id":"flight-gate-reassignment","region_id":"region-44d8060263"},{"after":"Boarding in 33","atom_id":"atom-reg06-boarding-count","before":"Boarding in 40","kind":"noise","mechanism_id":"flight-boarding-count-gauge","region_id":"region-2451168d91","target_class":"noise.volatile_value"},{"after":"Refreshed at 2026-08-24T06:27Z","atom_id":"atom-reg06-refresh-clock","before":"Refreshed at 2026-08-24T06:12Z","kind":"noise","mechanism_id":"flight-refresh-clock","region_id":"region-7946f74ea0","target_class":"noise.time_or_build_metadata"}],"expected_verdict":"material","fixture_id":"pc-regression-06","injection_markers":{"phrases":[],"region_ids":[],"task_ids":[]},"schema_version":1,"task_id":"page-ef87ffd2f4f3"}
