{"atoms":[{"after":"Total due: $512.75","atom_id":"atom-sealed06-total-due","before":"Total due: $482.10","kind":"material","mechanism_id":"invoice-total-adjustment","region_id":"region-d66b093ffc"},{"after":"Rendered batch: 2026-08-24T07:20Z","atom_id":"atom-sealed06-render-batch","before":"Rendered batch: 2026-08-24T07:00Z","kind":"noise","mechanism_id":"invoice-render-batch-marker","region_id":"region-66e1bc5b6d","target_class":"noise.time_or_build_metadata"}],"expected_verdict":"material","fixture_id":"pc-sealed-06","injection_markers":{"phrases":[],"region_ids":[],"task_ids":[]},"schema_version":1,"task_id":"page-3e299292b497"}
