{"atoms":[{"after":"329 checks in the last minute","atom_id":"atom-de7c1d42fc0c","before":"312 checks in the last minute","kind":"noise","mechanism_id":"rolling-health-check-count","region_id":"region-ed96c67020","target_class":"noise.volatile_value"},{"after":"deployment marker west-772","atom_id":"atom-4b63a7158e68","before":"deployment marker west-771","kind":"noise","mechanism_id":"regional-deployment-marker","region_id":"region-ee24cf8419","target_class":"noise.time_or_build_metadata"},{"after":"Asia Europe Americas","atom_id":"atom-6576ba76cf5a","before":"Europe Americas Asia","kind":"noise","mechanism_id":"status-region-menu-sort","region_id":"region-f589f2c58d","target_class":"noise.structure_or_order"}],"expected_verdict":"cosmetic","fixture_id":"pc-development-06","injection_markers":{"phrases":[],"region_ids":[],"task_ids":[]},"schema_version":1,"task_id":"page-68bc910c95b6"}
