{"atoms":[{"after":"63 applicants","atom_id":"atom-02bad8b3ba6f","before":"47 applicants","kind":"noise","mechanism_id":"applicant-progress-meter","region_id":"region-944167f5cc","target_class":"noise.volatile_value"},{"after":"posted 4 hours ago","atom_id":"atom-bb8ab249653a","before":"posted 3 hours ago","kind":"noise","mechanism_id":"relative-post-age","region_id":"region-31b0bf4f33","target_class":"noise.time_or_build_metadata"},{"after":"Learning fund Health plan Remote budget","atom_id":"atom-84f4e5dd774a","before":"Health plan Remote budget Learning fund","kind":"noise","mechanism_id":"benefit-list-permutation","region_id":"region-316244dc08","target_class":"noise.structure_or_order"}],"expected_verdict":"cosmetic","fixture_id":"pc-development-04","injection_markers":{"phrases":[],"region_ids":[],"task_ids":[]},"schema_version":1,"task_id":"page-d69ec70c5be7"}
