{"atoms":[{"after":"Open tickets: 47","atom_id":"atom-dev07-ticket-count","before":"Open tickets: 42","kind":"noise","mechanism_id":"queue-ticket-counter","region_id":"region-c7acb7a771","target_class":"noise.volatile_value"},{"after":"5 agents online","atom_id":"atom-dev07-agent-count","before":"3 agents online","kind":"noise","mechanism_id":"queue-agent-counter","region_id":"region-5ac24ba812","target_class":"noise.volatile_value"},{"after":"Snapshot at 2026-08-24T09:40Z","atom_id":"atom-dev07-snapshot-clock","before":"Snapshot at 2026-08-24T09:10Z","kind":"noise","mechanism_id":"queue-snapshot-clock","region_id":"region-00e9520658","target_class":"noise.time_or_build_metadata"}],"expected_verdict":"none","fixture_id":"pc-development-07","injection_markers":{"phrases":[],"region_ids":[],"task_ids":[]},"schema_version":1,"task_id":"page-17a3e9219b0e"}
