{"atoms":[{"after":"Returns accepted within 14 days.","atom_id":"atom-383b410d1ad8","before":"Returns accepted within 30 days.","kind":"material","mechanism_id":"return-window-reduction","region_id":"region-7789c04f47"},{"after":"Customer note: Helpful support.","atom_id":"atom-74cae8713bdd","before":"Customer note: Fast delivery.","kind":"noise","mechanism_id":"rotating-customer-note","region_id":"region-caefbdc2f5","target_class":"noise.volatile_value"},{"after":"cache batch mx-442","atom_id":"atom-313ed82376c5","before":"cache batch mx-441","kind":"noise","mechanism_id":"cache-batch-identifier","region_id":"region-1670bb7842","target_class":"noise.time_or_build_metadata"},{"after":"Contact Shipping Returns","atom_id":"atom-7d459daf5410","before":"Shipping Returns Contact","kind":"noise","mechanism_id":"footer-link-cycle","region_id":"region-fbe6f1dc5a","target_class":"noise.structure_or_order"}],"expected_verdict":"material","fixture_id":"pc-development-05","injection_markers":{"phrases":[],"region_ids":[],"task_ids":[]},"schema_version":1,"task_id":"page-065e83f9b1f6"}
