{"atoms":[{"after":"Featured supporter: R. Silva","atom_id":"atom-dd21d4e5b0c9","before":"Featured supporter: L. Chen","kind":"noise","mechanism_id":"featured-supporter-rotation","region_id":"region-629975b32a","target_class":"noise.volatile_value"},{"after":"guide generated on Wednesday","atom_id":"atom-dd82ba2e9918","before":"guide generated on Tuesday","kind":"noise","mechanism_id":"weekday-generation-label","region_id":"region-400a6cecd6","target_class":"noise.time_or_build_metadata"},{"after":"Textiles Maps Sculpture","atom_id":"atom-cd14f9acda76","before":"Maps Sculpture Textiles","kind":"noise","mechanism_id":"gallery-card-shuffle","region_id":"region-86d837e91f","target_class":"noise.structure_or_order"}],"expected_verdict":"cosmetic","fixture_id":"pc-regression-03","injection_markers":{"phrases":[],"region_ids":[],"task_ids":[]},"schema_version":1,"task_id":"page-1adaef544102"}
