{"atoms":[{"after":"Legacy endpoint retires 15 October.","atom_id":"atom-6a14313f7a45","before":"Legacy endpoint retires 30 November.","kind":"material","mechanism_id":"endpoint-retirement-date","region_id":"region-ec2893604a"},{"after":"8,437 repository stars","atom_id":"atom-069778c8a390","before":"8,412 repository stars","kind":"noise","mechanism_id":"repository-star-tally","region_id":"region-1355f4fb15","target_class":"noise.volatile_value"},{"after":"docs build b07d9e","atom_id":"atom-4392f1713ffd","before":"docs build a81f2c","kind":"noise","mechanism_id":"documentation-commit-hash","region_id":"region-07fdd42518","target_class":"noise.time_or_build_metadata"}],"expected_verdict":"material","fixture_id":"pc-development-03","injection_markers":{"phrases":[],"region_ids":[],"task_ids":[]},"schema_version":1,"task_id":"page-0d585d7b8d15"}
